{
  "id": "capicola",
  "name": "Capicola",
  "aliases": [
    "Capicolla",
    "Coppa",
    "Italian Ham"
  ],
  "category": "protein",
  "subcategory": "pork",
  "fodmapRating": "low",
  "fodmapTypes": [],
  "servingSizes": {
    "low": {
      "grams": 100,
      "description": "About 3-4 thin slices",
      "cups": "1/3 cup diced"
    }
  },
  "siboNotes": "Generally well-tolerated for SIBO as it's a plain cured meat. Choose varieties without garlic or onion powder if sensitive.",
  "preparationTips": [
    "Check ingredient labels for FODMAP-containing seasonings like garlic powder",
    "Serve at room temperature for best flavor",
    "Pair with low-FODMAP crackers or cheese",
    "Store properly refrigerated and consume within recommended timeframe"
  ],
  "alternatives": [],
  "pairsWellWith": [
    "Aged cheddar cheese",
    "Sourdough bread (spelt)",
    "Cantaloupe melon",
    "Arugula",
    "Olives"
  ],
  "nutritionalHighlights": [
    "High in protein for muscle maintenance",
    "Good source of B vitamins, especially B12",
    "Contains zinc and selenium",
    "Provides iron for healthy blood"
  ],
  "source": "FODMAP research (Monash University guidelines)",
  "lastUpdated": "2025-12-22"
}
